Названия товара,Старая цена,Новая цена
1985 Essential T-shirt van Supima-katoen,not old price,"49,90 €"
Set van 2 slim fit T-shirts met ronde hals,not old price,"49,90 €"
Biologisch katoenen longsleeve,"59,90 €","41,00 €"
Icons relaxed fit T-shirt,"69,90 €","48,00 €"
Biologisch katoenen longsleeve,"59,90 €","41,00 €"
Signature katoenen T-shirt met logoprint,"49,90 €","34,00 €"
Longsleeve met logo,"49,90 €","34,00 €"
Signature katoenen T-shirt met logoprint,"49,90 €","34,00 €"
Icons longsleeve met opstaande hals,"79,90 €","55,00 €"
Icons relaxed fit T-shirt,"69,90 €","48,00 €"
Biologisch katoenen longsleeve,"59,90 €","41,00 €"
T-shirt met Tommy Hilfiger-logo,not old price,"49,90 €"
T-shirt met camouflageprint en logo,not old price,"59,90 €"
1985 Essential T-shirt van Supima-katoen,not old price,"49,90 €"
1985 Essential T-shirt van Supima-katoen,not old price,"49,90 €"
Longsleeve met Henley-hals,not old price,"89,90 €"
Longsleeve met Henley-hals,not old price,"89,90 €"
Icons T-shirt met embleem,not old price,"69,90 €"
Icons T-shirt met geborduurd logo,not old price,"69,90 €"
T-shirt met logoprint,not old price,"49,90 €"
TH Cool T-shirt met geborduurd logo,not old price,"49,90 €"
T-shirt met grafische logotape,not old price,"39,90 €"
Icons T-shirt met embleem,not old price,"69,90 €"
T-shirt met ton-sur-ton embleem en logo,not old price,"130,00 €"
Icons T-shirt met embleem,not old price,"69,90 €"
Set van 2 gestreepte T-shirts,not old price,"49,90 €"
Longsleeve met logo en print,not old price,"54,90 €"
Set van 3 Premium Essential T-shirts,not old price,"44,90 €"
Original jersey T-shirt met logo,not old price,"34,90 €"
T-shirt met grafische logotape,not old price,"39,90 €"
Original colour-blocked T-shirt met logo,not old price,"34,90 €"
TH Cool T-shirt met geborduurd logo,not old price,"49,90 €"
T-shirt met signature-tape,not old price,"39,90 €"
Original colour-blocked T-shirt met logo,not old price,"34,90 €"
Signature T-shirt met split-logo,"39,90 €","27,00 €"
Plus T-shirt met logo,not old price,"39,90 €"
TH Cool T-shirt met geborduurd logo,not old price,"49,90 €"
T-shirt met camouflageprint en logo,not old price,"59,90 €"
T-shirt met geborduurd logo,not old price,"39,90 €"
T-shirt met pigment-dye en logo,not old price,"39,90 €"
T-shirt met logo op beide kanten,not old price,"44,90 €"
Elevated interlock T-shirt,not old price,"79,90 €"
Icons T-shirt met logo,not old price,"59,90 €"
Longsleeve met logo,not old price,"49,90 €"
T-shirt met surfboard-print,not old price,"39,90 €"
T-shirt met logo,not old price,"39,90 €"
Relaxed fit tanktop met grafische print,not old price,"29,90 €"
Elevated interlock T-shirt,not old price,"79,90 €"
T-shirt met bloemenlogo,not old price,"44,90 €"
T-shirt met wereldbollogo,not old price,"39,90 €"
T-shirt met logo rondom,not old price,"44,90 €"
T-shirt met geborduurde wapperende vlag,not old price,"69,90 €"
Boxy T-shirt van biologisch katoen,not old price,"49,90 €"
T-shirt met logo rondom,not old price,"44,90 €"
T-shirt met grafische logotape,not old price,"39,90 €"
T-shirt met signature-tape,not old price,"39,90 €"
T-shirt met logo en vlagpatch,"39,90 €","27,00 €"
Logo-T-shirt van biologisch katoenen jersey,"39,90 €","27,00 €"
T-shirt met geborduurd signature-logo,not old price,"39,90 €"
T-shirt met ronde hals,not old price,"24,90 €"
Classics T-shirt van biologisch katoen,not old price,"34,90 €"
Classics T-shirt met streep,not old price,"34,90 €"
Longsleeve met Henley-hals,"59,90 €","47,00 €"
TH Flex T-shirt met signature-detail,"49,90 €","24,00 €"
Biologisch katoenen T-shirt met badge,"39,90 €","27,00 €"
Biologisch katoenen T-shirt met rond logo,"39,90 €","27,00 €"
Longsleeve met logo,not old price,"59,90 €"
T-shirt met logotape,not old price,"39,90 €"
T-shirt met logo en vlagpatch,"39,90 €","27,00 €"
Slim fit longsleeve,"49,90 €","39,00 €"
T-shirt met logoprint,not old price,"49,90 €"
Longsleeve met geborduurd logo,"59,90 €","29,00 €"
T-shirt met Tommy Hilfiger-logo,not old price,"49,90 €"
T-shirt met signature-tape,not old price,"39,90 €"
Slim fit T-shirt met geborduurde vlag,"39,90 €","27,00 €"
1985 Essential T-shirt van Supima-katoen,not old price,"49,90 €"
T-shirt met logo en vlagpatch,not old price,"39,90 €"
Plus T-shirt met logo,not old price,"39,90 €"
Longsleeve met logo,not old price,"59,90 €"
Slim fit T-shirt met geborduurde vlag,not old price,"39,90 €"
Longsleeve van biologisch katoen,"39,90 €","27,00 €"
T-shirt met logo op beide kanten,not old price,"44,90 €"
Essential T-shirt met vlag,not old price,"29,90 €"
T-shirt met logoprint,not old price,"49,90 €"
Biologisch katoenen T-shirt met badge,not old price,"39,90 €"
Plus T-shirt met signature-tape,not old price,"39,90 €"
T-shirt met geborduurd signature-logo,not old price,"39,90 €"
T-shirt met ronde hals,not old price,"24,90 €"
Biologisch katoenen badge-T-shirt,"39,90 €","27,00 €"
T-shirt met geborduurd signature-logo,not old price,"39,90 €"
Icons T-shirt met logo,not old price,"59,90 €"
Sport Essential TH Cool T-shirt met logo,not old price,"39,90 €"
T-shirt met signature-tape,not old price,"39,90 €"
T-shirt met tie-dye logo,"39,90 €","27,00 €"
T-shirt met logo,not old price,"39,90 €"
Classics T-shirt van biologisch katoen,not old price,"34,90 €"
